"No.","Time","Source","Destination","Protocol","Length","Multiplex ID","NT Status","Info"
"1","0.000000","172.16.156.130","10.128.0.243","TCP","66","","","50927  >  445 [SYN] Seq=0 Win=8192 Len=0 MSS=1460 WS=256 SACK_PERM"
"2","0.030343","10.128.0.243","172.16.156.130","TCP","58","","","445  >  50927 [SYN, ACK] Seq=0 Ack=1 Win=64240 Len=0 MSS=1460"
"3","0.030539","172.16.156.130","10.128.0.243","TCP","54","","","50927  >  445 [ACK] Seq=1 Ack=1 Win=64240 Len=0"
"4","0.030730","172.16.156.130","10.128.0.243","SMB","191","64","STATUS_SUCCESS","Negotiate Protocol Request"
"5","0.030811","10.128.0.243","172.16.156.130","TCP","54","","","445  >  50927 [ACK] Seq=1 Ack=138 Win=64240 Len=0"
"6","0.058176","10.128.0.243","172.16.156.130","SMB","171","64","STATUS_SUCCESS","Negotiate Protocol Response"
"7","0.058447","172.16.156.130","10.128.0.243","SMB","194","64","STATUS_SUCCESS","Session Setup AndX Request, User: anonymous"
"8","0.058564","10.128.0.243","172.16.156.130","TCP","54","","","445  >  50927 [ACK] Seq=118 Ack=278 Win=64240 Len=0"
"9","0.092680","10.128.0.243","172.16.156.130","SMB","243","64","STATUS_SUCCESS","Session Setup AndX Response"
"10","0.095630","172.16.156.130","10.128.0.243","SMB","148","64","STATUS_SUCCESS","Tree Connect AndX Request, Path: \\\\10.128.0.243\\IPC$"
"11","0.095733","10.128.0.243","172.16.156.130","TCP","54","","","445  >  50927 [ACK] Seq=307 Ack=372 Win=64240 Len=0"
"12","0.129192","10.128.0.243","172.16.156.130","SMB","114","64","STATUS_SUCCESS","Tree Connect AndX Response"
"13","0.129433","172.16.156.130","10.128.0.243","SMB","136","65","STATUS_SUCCESS","Trans2 Request, SESSION_SETUP"
"14","0.129578","10.128.0.243","172.16.156.130","TCP","54","","","445  >  50927 [ACK] Seq=367 Ack=454 Win=64240 Len=0"
"15","0.165021","10.128.0.243","172.16.156.130","SMB","93","65","STATUS_NOT_IMPLEMENTED","Trans2 Response, SESSION_SETUP, Error: STATUS_NOT_IMPLEMENTED"
"16","0.169208","172.16.156.130","10.128.0.243","SMB","1138","65","STATUS_SUCCESS","NT Trans Request, <unknown>"
"17","0.169397","10.128.0.243","172.16.156.130","TCP","54","","","445  >  50927 [ACK] Seq=406 Ack=1538 Win=64240 Len=0"
"18","0.208296","10.128.0.243","172.16.156.130","SMB","93","65","STATUS_SUCCESS","NT Trans Response, <unknown (0)>"
"19","0.209065","172.16.156.130","10.128.0.243","TCP","1514","","","50927  >  445 [ACK] Seq=1538 Ack=445 Win=63796 Len=1460 [TCP segment of a reassembled PDU]"
"20","0.209081","172.16.156.130","10.128.0.243","TCP","1514","","","50927  >  445 [ACK] Seq=2998 Ack=445 Win=63796 Len=1460 [TCP segment of a reassembled PDU]"
"21","0.209096","172.16.156.130","10.128.0.243","SMB","1287","65","STATUS_SUCCESS","Trans2 Secondary Request, FID: 0x0000"
"22","0.209202","10.128.0.243","172.16.156.130","TCP","54","","","445  >  50927 [ACK] Seq=445 Ack=2998 Win=64240 Len=0"
"23","0.209255","172.16.156.130","10.128.0.243","TCP","1514","","","50927  >  445 [ACK] Seq=5691 Ack=445 Win=63796 Len=1460 [TCP segment of a reassembled PDU]"
"24","0.209273","172.16.156.130","10.128.0.243","TCP","1514","","","50927  >  445 [ACK] Seq=7151 Ack=445 Win=63796 Len=1460 [TCP segment of a reassembled PDU]"
"25","0.209289","10.128.0.243","172.16.156.130","TCP","54","","","445  >  50927 [ACK] Seq=445 Ack=4458 Win=64240 Len=0"
"26","0.209353","10.128.0.243","172.16.156.130","TCP","54","","","445  >  50927 [ACK] Seq=445 Ack=5691 Win=64240 Len=0"
"27","0.209452","10.128.0.243","172.16.156.130","TCP","54","","","445  >  50927 [ACK] Seq=445 Ack=7151 Win=64240 Len=0"
"28","0.209514","10.128.0.243","172.16.156.130","TCP","54","","","445  >  50927 [ACK] Seq=445 Ack=8611 Win=64240 Len=0"
"29","0.210752","172.16.156.130","10.128.0.243","SMB","1514","65","STATUS_SUCCESS","Trans2 Secondary Request, FID: 0x0000"
"30","0.210770","172.16.156.130","10.128.0.243","TCP","1514","","","50927  >  445 [ACK] Seq=10071 Ack=445 Win=63796 Len=1460 [TCP segment of a reassembled PDU]"
"31","0.210778","172.16.156.130","10.128.0.243","TCP","1514","","","50927  >  445 [ACK] Seq=11531 Ack=445 Win=63796 Len=1460 [TCP segment of a reassembled PDU]"
"32","0.210795","172.16.156.130","10.128.0.243","SMB","1514","65","STATUS_SUCCESS","Trans2 Secondary Request, FID: 0x0000"
"33","0.210815","172.16.156.130","10.128.0.243","TCP","1514","","","50927  >  445 [ACK] Seq=14451 Ack=445 Win=63796 Len=1460 [TCP segment of a reassembled PDU]"
"34","0.210818","10.128.0.243","172.16.156.130","TCP","54","","","445  >  50927 [ACK] Seq=445 Ack=10071 Win=64240 Len=0"
"35","0.210823","172.16.156.130","10.128.0.243","TCP","1514","","","50927  >  445 [ACK] Seq=15911 Ack=445 Win=63796 Len=1460 [TCP segment of a reassembled PDU]"
"36","0.210829","172.16.156.130","10.128.0.243","SMB","1514","65","STATUS_SUCCESS","Trans2 Secondary Request, FID: 0x0000"
"37","0.210838","172.16.156.130","10.128.0.243","TCP","1514","","","50927  >  445 [ACK] Seq=18831 Ack=445 Win=63796 Len=1460 [TCP segment of a reassembled PDU]"
"38","0.210844","172.16.156.130","10.128.0.243","TCP","1514","","","50927  >  445 [PSH, ACK] Seq=20291 Ack=445 Win=63796 Len=1460 [TCP segment of a reassembled PDU]"
"39","0.210886","10.128.0.243","172.16.156.130","TCP","54","","","445  >  50927 [ACK] Seq=445 Ack=11531 Win=64240 Len=0"
"40","0.210939","10.128.0.243","172.16.156.130","TCP","54","","","445  >  50927 [ACK] Seq=445 Ack=12991 Win=64240 Len=0"
"41","0.211004","10.128.0.243","172.16.156.130","TCP","54","","","445  >  50927 [ACK] Seq=445 Ack=14451 Win=64240 Len=0"
"42","0.211057","10.128.0.243","172.16.156.130","TCP","54","","","445  >  50927 [ACK] Seq=445 Ack=15911 Win=64240 Len=0"
"43","0.211112","10.128.0.243","172.16.156.130","TCP","54","","","445  >  50927 [ACK] Seq=445 Ack=17371 Win=64240 Len=0"
"44","0.211167","10.128.0.243","172.16.156.130","TCP","54","","","445  >  50927 [ACK] Seq=445 Ack=18831 Win=64240 Len=0"
"45","0.211168","172.16.156.130","10.128.0.243","SMB","1514","65","STATUS_SUCCESS","Trans2 Secondary Request, FID: 0x0000"
"46","0.211178","172.16.156.130","10.128.0.243","TCP","1514","","","50927  >  445 [ACK] Seq=23211 Ack=445 Win=63796 Len=1460 [TCP segment of a reassembled PDU]"
"47","0.211185","172.16.156.130","10.128.0.243","TCP","1514","","","50927  >  445 [ACK] Seq=24671 Ack=445 Win=63796 Len=1460 [TCP segment of a reassembled PDU]"
"48","0.211191","172.16.156.130","10.128.0.243","SMB","1514","65","STATUS_SUCCESS","Trans2 Secondary Request, FID: 0x0000"
"49","0.211198","172.16.156.130","10.128.0.243","TCP","1514","","","50927  >  445 [ACK] Seq=27591 Ack=445 Win=63796 Len=1460 [TCP segment of a reassembled PDU]"
"50","0.211205","172.16.156.130","10.128.0.243","TCP","1514","","","50927  >  445 [ACK] Seq=29051 Ack=445 Win=63796 Len=1460 [TCP segment of a reassembled PDU]"
"51","0.211210","172.16.156.130","10.128.0.243","SMB","1514","65","STATUS_SUCCESS","Trans2 Secondary Request, FID: 0x0000"
"52","0.211217","172.16.156.130","10.128.0.243","TCP","1514","","","50927  >  445 [ACK] Seq=31971 Ack=445 Win=63796 Len=1460 [TCP segment of a reassembled PDU]"
"53","0.211223","10.128.0.243","172.16.156.130","TCP","54","","","445  >  50927 [ACK] Seq=445 Ack=20291 Win=64240 Len=0"
"54","0.211224","172.16.156.130","10.128.0.243","SMB","1514","65","STATUS_SUCCESS","Trans2 Secondary Request, FID: 0x0000"
"55","0.211230","172.16.156.130","10.128.0.243","TCP","1514","","","50927  >  445 [PSH, ACK] Seq=34891 Ack=445 Win=63796 Len=1460 [TCP segment of a reassembled PDU]"
"56","0.211281","10.128.0.243","172.16.156.130","TCP","54","","","445  >  50927 [ACK] Seq=445 Ack=21751 Win=64240 Len=0"
"57","0.211334","10.128.0.243","172.16.156.130","TCP","54","","","445  >  50927 [ACK] Seq=445 Ack=23211 Win=64240 Len=0"
"58","0.211378","172.16.156.130","10.128.0.243","TCP","1514","","","50927  >  445 [ACK] Seq=36351 Ack=445 Win=63796 Len=1460 [TCP segment of a reassembled PDU]"
"59","0.211388","172.16.156.130","10.128.0.243","SMB","1514","65","STATUS_SUCCESS","Trans2 Secondary Request, FID: 0x0000"
"60","0.211391","10.128.0.243","172.16.156.130","TCP","54","","","445  >  50927 [ACK] Seq=445 Ack=24671 Win=64240 Len=0"
"61","0.211395","172.16.156.130","10.128.0.243","TCP","1514","","","50927  >  445 [ACK] Seq=39271 Ack=445 Win=63796 Len=1460 [TCP segment of a reassembled PDU]"
"62","0.211402","172.16.156.130","10.128.0.243","TCP","1514","","","50927  >  445 [ACK] Seq=40731 Ack=445 Win=63796 Len=1460 [TCP segment of a reassembled PDU]"
"63","0.211410","172.16.156.130","10.128.0.243","SMB","1514","65","STATUS_SUCCESS","Trans2 Secondary Request, FID: 0x0000"
"64","0.211417","172.16.156.130","10.128.0.243","TCP","1514","","","50927  >  445 [ACK] Seq=43651 Ack=445 Win=63796 Len=1460 [TCP segment of a reassembled PDU]"
"65","0.211423","172.16.156.130","10.128.0.243","TCP","1514","","","50927  >  445 [ACK] Seq=45111 Ack=445 Win=63796 Len=1460 [TCP segment of a reassembled PDU]"
"66","0.211430","172.16.156.130","10.128.0.243","SMB","1514","65","STATUS_SUCCESS","Trans2 Secondary Request, FID: 0x0000"
"67","0.211444","10.128.0.243","172.16.156.130","TCP","54","","","445  >  50927 [ACK] Seq=445 Ack=26131 Win=64240 Len=0"
"68","0.211500","10.128.0.243","172.16.156.130","TCP","54","","","445  >  50927 [ACK] Seq=445 Ack=27591 Win=64240 Len=0"
"69","0.211554","10.128.0.243","172.16.156.130","TCP","54","","","445  >  50927 [ACK] Seq=445 Ack=29051 Win=64240 Len=0"
"70","0.211574","172.16.156.130","10.128.0.243","TCP","1514","","","50927  >  445 [ACK] Seq=48031 Ack=445 Win=63796 Len=1460 [TCP segment of a reassembled PDU]"
"71","0.211582","172.16.156.130","10.128.0.243","TCP","1514","","","50927  >  445 [ACK] Seq=49491 Ack=445 Win=63796 Len=1460 [TCP segment of a reassembled PDU]"
"72","0.211589","172.16.156.130","10.128.0.243","SMB","1514","65","STATUS_SUCCESS","Trans2 Secondary Request, FID: 0x0000"
"73","0.211596","172.16.156.130","10.128.0.243","TCP","1514","","","50927  >  445 [ACK] Seq=52411 Ack=445 Win=63796 Len=1460 [TCP segment of a reassembled PDU]"
"74","0.211603","172.16.156.130","10.128.0.243","TCP","1514","","","50927  >  445 [ACK] Seq=53871 Ack=445 Win=63796 Len=1460 [TCP segment of a reassembled PDU]"
"75","0.211606","10.128.0.243","172.16.156.130","TCP","54","","","445  >  50927 [ACK] Seq=445 Ack=30511 Win=64240 Len=0"
"76","0.211610","172.16.156.130","10.128.0.243","SMB","1514","65","STATUS_SUCCESS","Trans2 Secondary Request, FID: 0x0000"
"77","0.211618","172.16.156.130","10.128.0.243","TCP","1514","","","50927  >  445 [ACK] Seq=56791 Ack=445 Win=63796 Len=1460 [TCP segment of a reassembled PDU]"
"78","0.211624","172.16.156.130","10.128.0.243","SMB","1514","65","STATUS_SUCCESS","Trans2 Secondary Request, FID: 0x0000"
"79","0.211660","10.128.0.243","172.16.156.130","TCP","54","","","445  >  50927 [ACK] Seq=445 Ack=31971 Win=64240 Len=0"
"80","0.211713","10.128.0.243","172.16.156.130","TCP","54","","","445  >  50927 [ACK] Seq=445 Ack=33431 Win=64240 Len=0"
"81","0.211774","10.128.0.243","172.16.156.130","TCP","54","","","445  >  50927 [ACK] Seq=445 Ack=34891 Win=64240 Len=0"
"82","0.211799","172.16.156.130","10.128.0.243","TCP","1514","","","50927  >  445 [ACK] Seq=59711 Ack=445 Win=63796 Len=1460 [TCP segment of a reassembled PDU]"
"83","0.211808","172.16.156.130","10.128.0.243","TCP","1514","","","50927  >  445 [ACK] Seq=61171 Ack=445 Win=63796 Len=1460 [TCP segment of a reassembled PDU]"
"84","0.211814","172.16.156.130","10.128.0.243","SMB","1309","65,65","STATUS_SUCCESS,STATUS_SUCCESS","Trans2 Secondary Request, FID: 0x0000Echo Request"
"85","0.211829","10.128.0.243","172.16.156.130","TCP","54","","","445  >  50927 [ACK] Seq=445 Ack=36351 Win=64240 Len=0"
"86","0.211883","10.128.0.243","172.16.156.130","TCP","54","","","445  >  50927 [ACK] Seq=445 Ack=37811 Win=64240 Len=0"
"87","0.211937","10.128.0.243","172.16.156.130","TCP","54","","","445  >  50927 [ACK] Seq=445 Ack=39271 Win=64240 Len=0"
"88","0.211992","10.128.0.243","172.16.156.130","TCP","54","","","445  >  50927 [ACK] Seq=445 Ack=40731 Win=64240 Len=0"
"89","0.212050","10.128.0.243","172.16.156.130","TCP","54","","","445  >  50927 [ACK] Seq=445 Ack=42191 Win=64240 Len=0"
"90","0.212103","10.128.0.243","172.16.156.130","TCP","54","","","445  >  50927 [ACK] Seq=445 Ack=43651 Win=64240 Len=0"
"91","0.212162","10.128.0.243","172.16.156.130","TCP","54","","","445  >  50927 [ACK] Seq=445 Ack=45111 Win=64240 Len=0"
"92","0.212224","10.128.0.243","172.16.156.130","TCP","54","","","445  >  50927 [ACK] Seq=445 Ack=46571 Win=64240 Len=0"
"93","0.212421","10.128.0.243","172.16.156.130","TCP","54","","","445  >  50927 [ACK] Seq=445 Ack=48031 Win=64240 Len=0"
"94","0.212521","10.128.0.243","172.16.156.130","TCP","54","","","445  >  50927 [ACK] Seq=445 Ack=49491 Win=64240 Len=0"
"95","0.212614","10.128.0.243","172.16.156.130","TCP","54","","","445  >  50927 [ACK] Seq=445 Ack=50951 Win=64240 Len=0"
"96","0.212692","10.128.0.243","172.16.156.130","TCP","54","","","445  >  50927 [ACK] Seq=445 Ack=52411 Win=64240 Len=0"
"97","0.212771","10.128.0.243","172.16.156.130","TCP","54","","","445  >  50927 [ACK] Seq=445 Ack=53871 Win=64240 Len=0"
"98","0.212862","10.128.0.243","172.16.156.130","TCP","54","","","445  >  50927 [ACK] Seq=445 Ack=55331 Win=64240 Len=0"
"99","0.212959","10.128.0.243","172.16.156.130","TCP","54","","","445  >  50927 [ACK] Seq=445 Ack=56791 Win=64240 Len=0"
"100","0.213024","10.128.0.243","172.16.156.130","TCP","54","","","445  >  50927 [ACK] Seq=445 Ack=58251 Win=64240 Len=0"
"101","0.213139","10.128.0.243","172.16.156.130","TCP","54","","","445  >  50927 [ACK] Seq=445 Ack=59711 Win=64240 Len=0"
"102","0.213347","10.128.0.243","172.16.156.130","TCP","54","","","445  >  50927 [ACK] Seq=445 Ack=61171 Win=64240 Len=0"
"103","0.213530","10.128.0.243","172.16.156.130","TCP","54","","","445  >  50927 [ACK] Seq=445 Ack=62631 Win=64240 Len=0"
"104","0.213705","10.128.0.243","172.16.156.130","TCP","54","","","445  >  50927 [ACK] Seq=445 Ack=63886 Win=64240 Len=0"
"105","0.371084","10.128.0.243","172.16.156.130","SMB","107","65","STATUS_SUCCESS","Echo Response"
"106","0.371555","172.16.156.130","10.128.0.243","TCP","66","","","50928  >  445 [SYN] Seq=0 Win=8192 Len=0 MSS=1460 WS=256 SACK_PERM"
"107","0.400037","10.128.0.243","172.16.156.130","TCP","58","","","445  >  50928 [SYN, ACK] Seq=0 Ack=1 Win=64240 Len=0 MSS=1460"
"108","0.400246","172.16.156.130","10.128.0.243","TCP","54","","","50928  >  445 [ACK] Seq=1 Ack=1 Win=64240 Len=0"
"109","0.400443","172.16.156.130","10.128.0.243","SMB","191","64","STATUS_SUCCESS","Negotiate Protocol Request"
"110","0.400509","10.128.0.243","172.16.156.130","TCP","54","","","445  >  50928 [ACK] Seq=1 Ack=138 Win=64240 Len=0"
"111","0.423559","172.16.156.130","10.128.0.243","TCP","54","","","50927  >  445 [ACK] Seq=63886 Ack=498 Win=63743 Len=0"
"112","0.501739","10.128.0.243","172.16.156.130","SMB","185","64","STATUS_SUCCESS","Negotiate Protocol Response"
"113","0.502008","172.16.156.130","10.128.0.243","SMB","139","64","STATUS_SUCCESS","Session Setup AndX Request"
"114","0.502087","10.128.0.243","172.16.156.130","TCP","54","","","445  >  50928 [ACK] Seq=132 Ack=223 Win=64240 Len=0"
"115","0.534848","10.128.0.243","172.16.156.130","SMB","243","64","STATUS_SUCCESS","Session Setup AndX Response"
"116","0.535259","172.16.156.130","10.128.0.243","TCP","66","","","50929  >  445 [SYN] Seq=0 Win=8192 Len=0 MSS=1460 WS=256 SACK_PERM"
"117","0.562860","10.128.0.243","172.16.156.130","TCP","58","","","445  >  50929 [SYN, ACK] Seq=0 Ack=1 Win=64240 Len=0 MSS=1460"
"118","0.563026","172.16.156.130","10.128.0.243","TCP","54","","","50929  >  445 [ACK] Seq=1 Ack=1 Win=64240 Len=0"
"119","0.563137","172.16.156.130","10.128.0.243","TCP","186","","","50929  >  445 [PSH, ACK] Seq=1 Ack=1 Win=64240 Len=132 [TCP segment of a reassembled PDU]"
"120","0.563215","10.128.0.243","172.16.156.130","TCP","54","","","445  >  50929 [ACK] Seq=1 Ack=133 Win=64240 Len=0"
"121","0.563395","172.16.156.130","10.128.0.243","TCP","66","","","50930  >  445 [SYN] Seq=0 Win=8192 Len=0 MSS=1460 WS=256 SACK_PERM"
"122","0.592356","172.16.156.130","10.128.0.243","TCP","54","","","50928  >  445 [ACK] Seq=223 Ack=321 Win=63920 Len=0"
"123","0.593193","10.128.0.243","172.16.156.130","TCP","58","","","445  >  50930 [SYN, ACK] Seq=0 Ack=1 Win=64240 Len=0 MSS=1460"
"124","0.593432","172.16.156.130","10.128.0.243","TCP","54","","","50930  >  445 [ACK] Seq=1 Ack=1 Win=64240 Len=0"
"125","0.593617","172.16.156.130","10.128.0.243","TCP","186","","","50930  >  445 [PSH, ACK] Seq=1 Ack=1 Win=64240 Len=132 [TCP segment of a reassembled PDU]"
"126","0.593744","10.128.0.243","172.16.156.130","TCP","54","","","445  >  50930 [ACK] Seq=1 Ack=133 Win=64240 Len=0"
"127","0.593917","172.16.156.130","10.128.0.243","TCP","66","","","50931  >  445 [SYN] Seq=0 Win=8192 Len=0 MSS=1460 WS=256 SACK_PERM"
"128","0.623068","10.128.0.243","172.16.156.130","TCP","58","","","445  >  50931 [SYN, ACK] Seq=0 Ack=1 Win=64240 Len=0 MSS=1460"
"129","0.623724","172.16.156.130","10.128.0.243","TCP","54","","","50931  >  445 [ACK] Seq=1 Ack=1 Win=64240 Len=0"
"130","0.623888","172.16.156.130","10.128.0.243","TCP","186","","","50931  >  445 [PSH, ACK] Seq=1 Ack=1 Win=64240 Len=132 [TCP segment of a reassembled PDU]"
"131","0.623985","10.128.0.243","172.16.156.130","TCP","54","","","445  >  50931 [ACK] Seq=1 Ack=133 Win=64240 Len=0"
"132","0.624202","172.16.156.130","10.128.0.243","TCP","66","","","50932  >  445 [SYN] Seq=0 Win=8192 Len=0 MSS=1460 WS=256 SACK_PERM"
"133","0.653683","10.128.0.243","172.16.156.130","TCP","58","","","445  >  50932 [SYN, ACK] Seq=0 Ack=1 Win=64240 Len=0 MSS=1460"
"134","0.654778","172.16.156.130","10.128.0.243","TCP","54","","","50932  >  445 [ACK] Seq=1 Ack=1 Win=64240 Len=0"
"135","0.654922","172.16.156.130","10.128.0.243","TCP","186","","","50932  >  445 [PSH, ACK] Seq=1 Ack=1 Win=64240 Len=132 [TCP segment of a reassembled PDU]"
"136","0.655019","10.128.0.243","172.16.156.130","TCP","54","","","445  >  50932 [ACK] Seq=1 Ack=133 Win=64240 Len=0"
"137","0.655254","172.16.156.130","10.128.0.243","TCP","66","","","50933  >  445 [SYN] Seq=0 Win=8192 Len=0 MSS=1460 WS=256 SACK_PERM"
"138","0.683919","10.128.0.243","172.16.156.130","TCP","58","","","445  >  50933 [SYN, ACK] Seq=0 Ack=1 Win=64240 Len=0 MSS=1460"
"139","0.684112","172.16.156.130","10.128.0.243","TCP","54","","","50933  >  445 [ACK] Seq=1 Ack=1 Win=64240 Len=0"
"140","0.684221","172.16.156.130","10.128.0.243","TCP","186","","","50933  >  445 [PSH, ACK] Seq=1 Ack=1 Win=64240 Len=132 [TCP segment of a reassembled PDU]"
"141","0.684391","10.128.0.243","172.16.156.130","TCP","54","","","445  >  50933 [ACK] Seq=1 Ack=133 Win=64240 Len=0"
"142","0.684443","172.16.156.130","10.128.0.243","TCP","66","","","50934  >  445 [SYN] Seq=0 Win=8192 Len=0 MSS=1460 WS=256 SACK_PERM"
"143","0.712980","10.128.0.243","172.16.156.130","TCP","58","","","445  >  50934 [SYN, ACK] Seq=0 Ack=1 Win=64240 Len=0 MSS=1460"
"144","0.713386","172.16.156.130","10.128.0.243","TCP","54","","","50934  >  445 [ACK] Seq=1 Ack=1 Win=64240 Len=0"
"145","0.713719","172.16.156.130","10.128.0.243","TCP","186","","","50934  >  445 [PSH, ACK] Seq=1 Ack=1 Win=64240 Len=132 [TCP segment of a reassembled PDU]"
"146","0.713962","10.128.0.243","172.16.156.130","TCP","54","","","445  >  50934 [ACK] Seq=1 Ack=133 Win=64240 Len=0"
"147","0.714973","172.16.156.130","10.128.0.243","TCP","66","","","50935  >  445 [SYN] Seq=0 Win=8192 Len=0 MSS=1460 WS=256 SACK_PERM"
"148","0.743740","10.128.0.243","172.16.156.130","TCP","58","","","445  >  50935 [SYN, ACK] Seq=0 Ack=1 Win=64240 Len=0 MSS=1460"
"149","0.743957","172.16.156.130","10.128.0.243","TCP","54","","","50935  >  445 [ACK] Seq=1 Ack=1 Win=64240 Len=0"
"150","0.744125","172.16.156.130","10.128.0.243","TCP","186","","","50935  >  445 [PSH, ACK] Seq=1 Ack=1 Win=64240 Len=132 [TCP segment of a reassembled PDU]"
"151","0.744203","10.128.0.243","172.16.156.130","TCP","54","","","445  >  50935 [ACK] Seq=1 Ack=133 Win=64240 Len=0"
"152","0.744389","172.16.156.130","10.128.0.243","TCP","66","","","50936  >  445 [SYN] Seq=0 Win=8192 Len=0 MSS=1460 WS=256 SACK_PERM"
"153","0.774359","10.128.0.243","172.16.156.130","TCP","58","","","445  >  50936 [SYN, ACK] Seq=0 Ack=1 Win=64240 Len=0 MSS=1460"
"154","0.774510","172.16.156.130","10.128.0.243","TCP","54","","","50936  >  445 [ACK] Seq=1 Ack=1 Win=64240 Len=0"
"155","0.774624","172.16.156.130","10.128.0.243","TCP","186","","","50936  >  445 [PSH, ACK] Seq=1 Ack=1 Win=64240 Len=132 [TCP segment of a reassembled PDU]"
"156","0.774715","10.128.0.243","172.16.156.130","TCP","54","","","445  >  50936 [ACK] Seq=1 Ack=133 Win=64240 Len=0"
"157","0.774893","172.16.156.130","10.128.0.243","TCP","66","","","50937  >  445 [SYN] Seq=0 Win=8192 Len=0 MSS=1460 WS=256 SACK_PERM"
"158","0.803645","10.128.0.243","172.16.156.130","TCP","58","","","445  >  50937 [SYN, ACK] Seq=0 Ack=1 Win=64240 Len=0 MSS=1460"
"159","0.803941","172.16.156.130","10.128.0.243","TCP","54","","","50937  >  445 [ACK] Seq=1 Ack=1 Win=64240 Len=0"
"160","0.804147","172.16.156.130","10.128.0.243","TCP","186","","","50937  >  445 [PSH, ACK] Seq=1 Ack=1 Win=64240 Len=132 [TCP segment of a reassembled PDU]"
"161","0.804226","10.128.0.243","172.16.156.130","TCP","54","","","445  >  50937 [ACK] Seq=1 Ack=133 Win=64240 Len=0"
"162","0.804551","172.16.156.130","10.128.0.243","TCP","66","","","50938  >  445 [SYN] Seq=0 Win=8192 Len=0 MSS=1460 WS=256 SACK_PERM"
"163","0.832520","10.128.0.243","172.16.156.130","TCP","58","","","445  >  50938 [SYN, ACK] Seq=0 Ack=1 Win=64240 Len=0 MSS=1460"
"164","0.832732","172.16.156.130","10.128.0.243","TCP","54","","","50938  >  445 [ACK] Seq=1 Ack=1 Win=64240 Len=0"
"165","0.832882","172.16.156.130","10.128.0.243","TCP","186","","","50938  >  445 [PSH, ACK] Seq=1 Ack=1 Win=64240 Len=132 [TCP segment of a reassembled PDU]"
"166","0.832966","10.128.0.243","172.16.156.130","TCP","54","","","445  >  50938 [ACK] Seq=1 Ack=133 Win=64240 Len=0"
"167","0.833177","172.16.156.130","10.128.0.243","TCP","66","","","50939  >  445 [SYN] Seq=0 Win=8192 Len=0 MSS=1460 WS=256 SACK_PERM"
"168","0.861477","10.128.0.243","172.16.156.130","TCP","58","","","445  >  50939 [SYN, ACK] Seq=0 Ack=1 Win=64240 Len=0 MSS=1460"
"169","0.861697","172.16.156.130","10.128.0.243","TCP","54","","","50939  >  445 [ACK] Seq=1 Ack=1 Win=64240 Len=0"
"170","0.861838","172.16.156.130","10.128.0.243","TCP","186","","","50939  >  445 [PSH, ACK] Seq=1 Ack=1 Win=64240 Len=132 [TCP segment of a reassembled PDU]"
"171","0.861967","10.128.0.243","172.16.156.130","TCP","54","","","445  >  50939 [ACK] Seq=1 Ack=133 Win=64240 Len=0"
"172","0.862162","172.16.156.130","10.128.0.243","TCP","66","","","50940  >  445 [SYN] Seq=0 Win=8192 Len=0 MSS=1460 WS=256 SACK_PERM"
"173","0.890363","10.128.0.243","172.16.156.130","TCP","58","","","445  >  50940 [SYN, ACK] Seq=0 Ack=1 Win=64240 Len=0 MSS=1460"
"174","0.890574","172.16.156.130","10.128.0.243","TCP","54","","","50940  >  445 [ACK] Seq=1 Ack=1 Win=64240 Len=0"
"175","0.890706","172.16.156.130","10.128.0.243","TCP","186","","","50940  >  445 [PSH, ACK] Seq=1 Ack=1 Win=64240 Len=132 [TCP segment of a reassembled PDU]"
"176","0.890782","10.128.0.243","172.16.156.130","TCP","54","","","445  >  50940 [ACK] Seq=1 Ack=133 Win=64240 Len=0"
"177","0.891785","172.16.156.130","10.128.0.243","TCP","66","","","50941  >  445 [SYN] Seq=0 Win=8192 Len=0 MSS=1460 WS=256 SACK_PERM"
"178","0.921030","10.128.0.243","172.16.156.130","TCP","58","","","445  >  50941 [SYN, ACK] Seq=0 Ack=1 Win=64240 Len=0 MSS=1460"
"179","0.921240","172.16.156.130","10.128.0.243","TCP","54","","","50941  >  445 [ACK] Seq=1 Ack=1 Win=64240 Len=0"
"180","0.921372","172.16.156.130","10.128.0.243","TCP","186","","","50941  >  445 [PSH, ACK] Seq=1 Ack=1 Win=64240 Len=132 [TCP segment of a reassembled PDU]"
"181","0.921463","10.128.0.243","172.16.156.130","TCP","54","","","445  >  50941 [ACK] Seq=1 Ack=133 Win=64240 Len=0"
"182","0.921710","172.16.156.130","10.128.0.243","TCP","66","","","50942  >  445 [SYN] Seq=0 Win=8192 Len=0 MSS=1460 WS=256 SACK_PERM"
"183","0.949876","10.128.0.243","172.16.156.130","TCP","58","","","445  >  50942 [SYN, ACK] Seq=0 Ack=1 Win=64240 Len=0 MSS=1460"
"184","0.950089","172.16.156.130","10.128.0.243","TCP","54","","","50942  >  445 [ACK] Seq=1 Ack=1 Win=64240 Len=0"
"185","0.950210","172.16.156.130","10.128.0.243","SMB","191","64","STATUS_SUCCESS","Negotiate Protocol Request"
"186","0.950323","10.128.0.243","172.16.156.130","TCP","54","","","445  >  50942 [ACK] Seq=1 Ack=138 Win=64240 Len=0"
"187","0.983931","10.128.0.243","172.16.156.130","SMB","185","64","STATUS_SUCCESS","Negotiate Protocol Response"
"188","0.984171","172.16.156.130","10.128.0.243","SMB","139","64","STATUS_SUCCESS","Session Setup AndX Request"
"189","0.984289","10.128.0.243","172.16.156.130","TCP","54","","","445  >  50942 [ACK] Seq=132 Ack=223 Win=64240 Len=0"
"190","1.012032","10.128.0.243","172.16.156.130","SMB","171","64","STATUS_SUCCESS","Session Setup AndX Response"
"191","1.012376","172.16.156.130","10.128.0.243","TCP","54","","","50928  >  445 [FIN, ACK] Seq=223 Ack=321 Win=63920 Len=0"
"192","1.012958","172.16.156.130","10.128.0.243","TCP","66","","","50943  >  445 [SYN] Seq=0 Win=8192 Len=0 MSS=1460 WS=256 SACK_PERM"
"193","1.013023","10.128.0.243","172.16.156.130","TCP","54","","","445  >  50928 [ACK] Seq=321 Ack=224 Win=64239 Len=0"
"194","1.042152","10.128.0.243","172.16.156.130","TCP","54","","","445  >  50928 [RST, ACK] Seq=321 Ack=224 Win=64239 Len=0"
"195","1.042246","10.128.0.243","172.16.156.130","TCP","58","","","445  >  50943 [SYN, ACK] Seq=0 Ack=1 Win=64240 Len=0 MSS=1460"
"196","1.042454","172.16.156.130","10.128.0.243","TCP","54","","","50943  >  445 [ACK] Seq=1 Ack=1 Win=64240 Len=0"
"197","1.042648","172.16.156.130","10.128.0.243","TCP","186","","","50943  >  445 [PSH, ACK] Seq=1 Ack=1 Win=64240 Len=132 [TCP segment of a reassembled PDU]"
"198","1.042756","10.128.0.243","172.16.156.130","TCP","54","","","445  >  50943 [ACK] Seq=1 Ack=133 Win=64240 Len=0"
"199","1.042920","172.16.156.130","10.128.0.243","TCP","66","","","50944  >  445 [SYN] Seq=0 Win=8192 Len=0 MSS=1460 WS=256 SACK_PERM"
"200","1.070226","172.16.156.130","10.128.0.243","TCP","54","","","50942  >  445 [ACK] Seq=223 Ack=249 Win=63992 Len=0"
"201","1.073170","10.128.0.243","172.16.156.130","TCP","58","","","445  >  50944 [SYN, ACK] Seq=0 Ack=1 Win=64240 Len=0 MSS=1460"
"202","1.073536","172.16.156.130","10.128.0.243","TCP","54","","","50944  >  445 [ACK] Seq=1 Ack=1 Win=64240 Len=0"
"203","1.073655","172.16.156.130","10.128.0.243","TCP","186","","","50944  >  445 [PSH, ACK] Seq=1 Ack=1 Win=64240 Len=132 [TCP segment of a reassembled PDU]"
"204","1.073745","10.128.0.243","172.16.156.130","TCP","54","","","445  >  50944 [ACK] Seq=1 Ack=133 Win=64240 Len=0"
"205","1.073977","172.16.156.130","10.128.0.243","TCP","66","","","50945  >  445 [SYN] Seq=0 Win=8192 Len=0 MSS=1460 WS=256 SACK_PERM"
"206","1.103565","10.128.0.243","172.16.156.130","TCP","58","","","445  >  50945 [SYN, ACK] Seq=0 Ack=1 Win=64240 Len=0 MSS=1460"
"207","1.103798","172.16.156.130","10.128.0.243","TCP","54","","","50945  >  445 [ACK] Seq=1 Ack=1 Win=64240 Len=0"
"208","1.103987","172.16.156.130","10.128.0.243","TCP","186","","","50945  >  445 [PSH, ACK] Seq=1 Ack=1 Win=64240 Len=132 [TCP segment of a reassembled PDU]"
"209","1.104088","10.128.0.243","172.16.156.130","TCP","54","","","445  >  50945 [ACK] Seq=1 Ack=133 Win=64240 Len=0"
"210","1.104308","172.16.156.130","10.128.0.243","TCP","66","","","50946  >  445 [SYN] Seq=0 Win=8192 Len=0 MSS=1460 WS=256 SACK_PERM"
"211","1.132762","10.128.0.243","172.16.156.130","TCP","58","","","445  >  50946 [SYN, ACK] Seq=0 Ack=1 Win=64240 Len=0 MSS=1460"
"212","1.132964","172.16.156.130","10.128.0.243","TCP","54","","","50946  >  445 [ACK] Seq=1 Ack=1 Win=64240 Len=0"
"213","1.133178","172.16.156.130","10.128.0.243","TCP","186","","","50946  >  445 [PSH, ACK] Seq=1 Ack=1 Win=64240 Len=132 [TCP segment of a reassembled PDU]"
"214","1.133296","10.128.0.243","172.16.156.130","TCP","54","","","445  >  50946 [ACK] Seq=1 Ack=133 Win=64240 Len=0"
"215","1.133436","172.16.156.130","10.128.0.243","TCP","66","","","50947  >  445 [SYN] Seq=0 Win=8192 Len=0 MSS=1460 WS=256 SACK_PERM"
"216","1.163038","10.128.0.243","172.16.156.130","TCP","58","","","445  >  50947 [SYN, ACK] Seq=0 Ack=1 Win=64240 Len=0 MSS=1460"
"217","1.163280","172.16.156.130","10.128.0.243","TCP","54","","","50947  >  445 [ACK] Seq=1 Ack=1 Win=64240 Len=0"
"218","1.163463","172.16.156.130","10.128.0.243","TCP","186","","","50947  >  445 [PSH, ACK] Seq=1 Ack=1 Win=64240 Len=132 [TCP segment of a reassembled PDU]"
"219","1.163545","10.128.0.243","172.16.156.130","TCP","54","","","445  >  50947 [ACK] Seq=1 Ack=133 Win=64240 Len=0"
"220","2.169596","172.16.156.130","10.128.0.243","TCP","54","","","50942  >  445 [FIN, ACK] Seq=223 Ack=249 Win=63992 Len=0"
"221","2.169692","172.16.156.130","10.128.0.243","SMB","107","65","STATUS_SUCCESS","Echo Request"
"222","2.169761","10.128.0.243","172.16.156.130","TCP","54","","","445  >  50942 [ACK] Seq=249 Ack=224 Win=64239 Len=0"
"223","2.169859","10.128.0.243","172.16.156.130","TCP","54","","","445  >  50927 [ACK] Seq=498 Ack=63939 Win=64240 Len=0"
"224","2.199072","10.128.0.243","172.16.156.130","TCP","54","","","445  >  50942 [RST, ACK] Seq=249 Ack=224 Win=64239 Len=0"
"225","2.199190","10.128.0.243","172.16.156.130","SMB","107","65","STATUS_SUCCESS","Echo Response"
"226","2.200223","172.16.156.130","10.128.0.243","TCP","1514","","","50927  >  445 [ACK] Seq=63939 Ack=551 Win=63690 Len=1460 [TCP segment of a reassembled PDU]"
"227","2.200234","172.16.156.130","10.128.0.243","TCP","1514","","","50927  >  445 [ACK] Seq=65399 Ack=551 Win=63690 Len=1460 [TCP segment of a reassembled PDU]"
"228","2.200243","172.16.156.130","10.128.0.243","SMB","1287","65","STATUS_SUCCESS","Trans2 Secondary Request, FID: 0x0000"
"229","2.200319","10.128.0.243","172.16.156.130","TCP","54","","","445  >  50927 [ACK] Seq=551 Ack=65399 Win=64240 Len=0"
"230","2.200411","10.128.0.243","172.16.156.130","TCP","54","","","445  >  50927 [ACK] Seq=551 Ack=66859 Win=64240 Len=0"
"231","2.200493","10.128.0.243","172.16.156.130","TCP","54","","","445  >  50927 [ACK] Seq=551 Ack=68092 Win=64240 Len=0"
"232","2.260604","10.128.0.243","172.16.156.130","SMB","146","65","STATUS_INVALID_PARAMETER","Trans2 Response<unknown>, Error: STATUS_INVALID_PARAMETER"
"233","2.260823","172.16.156.130","10.128.0.243","TCP","1514","","","50929  >  445 [ACK] Seq=133 Ack=1 Win=64240 Len=1460 [TCP segment of a reassembled PDU]"
"234","2.260852","172.16.156.130","10.128.0.243","TCP","1514","","","50929  >  445 [ACK] Seq=1593 Ack=1 Win=64240 Len=1460 [TCP segment of a reassembled PDU]"
"235","2.260864","172.16.156.130","10.128.0.243","TCP","1206","","","50929  >  445 [PSH, ACK] Seq=3053 Ack=1 Win=64240 Len=1152 [TCP segment of a reassembled PDU]"
"236","2.260934","10.128.0.243","172.16.156.130","TCP","54","","","445  >  50929 [ACK] Seq=1 Ack=1593 Win=64240 Len=0"
"237","2.260964","172.16.156.130","10.128.0.243","TCP","1514","","","50930  >  445 [ACK] Seq=133 Ack=1 Win=64240 Len=1460 [TCP segment of a reassembled PDU]"
"238","2.260975","172.16.156.130","10.128.0.243","TCP","1514","","","50930  >  445 [ACK] Seq=1593 Ack=1 Win=64240 Len=1460 [TCP segment of a reassembled PDU]"
"239","2.260983","172.16.156.130","10.128.0.243","TCP","1206","","","50930  >  445 [PSH, ACK] Seq=3053 Ack=1 Win=64240 Len=1152 [TCP segment of a reassembled PDU]"
"240","2.261060","172.16.156.130","10.128.0.243","TCP","1514","","","50931  >  445 [ACK] Seq=133 Ack=1 Win=64240 Len=1460 [TCP segment of a reassembled PDU]"
"241","2.261071","172.16.156.130","10.128.0.243","TCP","1514","","","50931  >  445 [ACK] Seq=1593 Ack=1 Win=64240 Len=1460 [TCP segment of a reassembled PDU]"
"242","2.261078","172.16.156.130","10.128.0.243","TCP","1206","","","50931  >  445 [PSH, ACK] Seq=3053 Ack=1 Win=64240 Len=1152 [TCP segment of a reassembled PDU]"
"243","2.261099","10.128.0.243","172.16.156.130","TCP","54","","","445  >  50929 [ACK] Seq=1 Ack=3053 Win=64240 Len=0"
"244","2.261141","172.16.156.130","10.128.0.243","TCP","1514","","","50932  >  445 [ACK] Seq=133 Ack=1 Win=64240 Len=1460 [TCP segment of a reassembled PDU]"
"245","2.261188","10.128.0.243","172.16.156.130","TCP","54","","","445  >  50929 [ACK] Seq=1 Ack=4205 Win=64240 Len=0"
"246","2.261222","172.16.156.130","10.128.0.243","TCP","1514","","","50932  >  445 [ACK] Seq=1593 Ack=1 Win=64240 Len=1460 [TCP segment of a reassembled PDU]"
"247","2.261231","172.16.156.130","10.128.0.243","TCP","1206","","","50932  >  445 [PSH, ACK] Seq=3053 Ack=1 Win=64240 Len=1152 [TCP segment of a reassembled PDU]"
"248","2.261290","10.128.0.243","172.16.156.130","TCP","54","","","445  >  50930 [ACK] Seq=1 Ack=1593 Win=64240 Len=0"
"249","2.261304","172.16.156.130","10.128.0.243","TCP","1514","","","50933  >  445 [ACK] Seq=133 Ack=1 Win=64240 Len=1460 [TCP segment of a reassembled PDU]"
"250","2.261313","172.16.156.130","10.128.0.243","TCP","1514","","","50933  >  445 [ACK] Seq=1593 Ack=1 Win=64240 Len=1460 [TCP segment of a reassembled PDU]"
"251","2.261319","172.16.156.130","10.128.0.243","TCP","1206","","","50933  >  445 [PSH, ACK] Seq=3053 Ack=1 Win=64240 Len=1152 [TCP segment of a reassembled PDU]"
"252","2.261409","172.16.156.130","10.128.0.243","TCP","1514","","","50934  >  445 [ACK] Seq=133 Ack=1 Win=64240 Len=1460 [TCP segment of a reassembled PDU]"
"253","2.261423","172.16.156.130","10.128.0.243","TCP","1514","","","50934  >  445 [ACK] Seq=1593 Ack=1 Win=64240 Len=1460 [TCP segment of a reassembled PDU]"
"254","2.261429","10.128.0.243","172.16.156.130","TCP","54","","","445  >  50930 [ACK] Seq=1 Ack=3053 Win=64240 Len=0"
"255","2.261431","172.16.156.130","10.128.0.243","TCP","1206","","","50934  >  445 [PSH, ACK] Seq=3053 Ack=1 Win=64240 Len=1152 [TCP segment of a reassembled PDU]"
"256","2.261497","172.16.156.130","10.128.0.243","TCP","1514","","","50935  >  445 [ACK] Seq=133 Ack=1 Win=64240 Len=1460 [TCP segment of a reassembled PDU]"
"257","2.261506","172.16.156.130","10.128.0.243","TCP","1514","","","50935  >  445 [ACK] Seq=1593 Ack=1 Win=64240 Len=1460 [TCP segment of a reassembled PDU]"
"258","2.261516","10.128.0.243","172.16.156.130","TCP","54","","","445  >  50930 [ACK] Seq=1 Ack=4205 Win=64240 Len=0"
"259","2.261523","172.16.156.130","10.128.0.243","TCP","1206","","","50935  >  445 [PSH, ACK] Seq=3053 Ack=1 Win=64240 Len=1152 [TCP segment of a reassembled PDU]"
"260","2.261586","172.16.156.130","10.128.0.243","TCP","1514","","","50936  >  445 [ACK] Seq=133 Ack=1 Win=64240 Len=1460 [TCP segment of a reassembled PDU]"
"261","2.261595","172.16.156.130","10.128.0.243","TCP","1514","","","50936  >  445 [ACK] Seq=1593 Ack=1 Win=64240 Len=1460 [TCP segment of a reassembled PDU]"
"262","2.261602","172.16.156.130","10.128.0.243","TCP","1206","","","50936  >  445 [PSH, ACK] Seq=3053 Ack=1 Win=64240 Len=1152 [TCP segment of a reassembled PDU]"
"263","2.261604","10.128.0.243","172.16.156.130","TCP","54","","","445  >  50931 [ACK] Seq=1 Ack=1593 Win=64240 Len=0"
"264","2.261665","172.16.156.130","10.128.0.243","TCP","1514","","","50937  >  445 [ACK] Seq=133 Ack=1 Win=64240 Len=1460 [TCP segment of a reassembled PDU]"
"265","2.261675","172.16.156.130","10.128.0.243","TCP","1514","","","50937  >  445 [ACK] Seq=1593 Ack=1 Win=64240 Len=1460 [TCP segment of a reassembled PDU]"
"266","2.261681","172.16.156.130","10.128.0.243","TCP","1206","","","50937  >  445 [PSH, ACK] Seq=3053 Ack=1 Win=64240 Len=1152 [TCP segment of a reassembled PDU]"
"267","2.261706","10.128.0.243","172.16.156.130","TCP","54","","","445  >  50931 [ACK] Seq=1 Ack=3053 Win=64240 Len=0"
"268","2.261781","10.128.0.243","172.16.156.130","TCP","54","","","445  >  50931 [ACK] Seq=1 Ack=4205 Win=64240 Len=0"
"269","2.261786","172.16.156.130","10.128.0.243","TCP","1514","","","50938  >  445 [ACK] Seq=133 Ack=1 Win=64240 Len=1460 [TCP segment of a reassembled PDU]"
"270","2.261800","172.16.156.130","10.128.0.243","TCP","1514","","","50938  >  445 [ACK] Seq=1593 Ack=1 Win=64240 Len=1460 [TCP segment of a reassembled PDU]"
"271","2.261811","172.16.156.130","10.128.0.243","TCP","1206","","","50938  >  445 [PSH, ACK] Seq=3053 Ack=1 Win=64240 Len=1152 [TCP segment of a reassembled PDU]"
"272","2.261871","172.16.156.130","10.128.0.243","TCP","1514","","","50939  >  445 [ACK] Seq=133 Ack=1 Win=64240 Len=1460 [TCP segment of a reassembled PDU]"
"273","2.261881","172.16.156.130","10.128.0.243","TCP","1514","","","50939  >  445 [ACK] Seq=1593 Ack=1 Win=64240 Len=1460 [TCP segment of a reassembled PDU]"
"274","2.261891","10.128.0.243","172.16.156.130","TCP","54","","","445  >  50932 [ACK] Seq=1 Ack=1593 Win=64240 Len=0"
"275","2.261893","172.16.156.130","10.128.0.243","TCP","1206","","","50939  >  445 [PSH, ACK] Seq=3053 Ack=1 Win=64240 Len=1152 [TCP segment of a reassembled PDU]"
"276","2.261953","172.16.156.130","10.128.0.243","TCP","1514","","","50940  >  445 [ACK] Seq=133 Ack=1 Win=64240 Len=1460 [TCP segment of a reassembled PDU]"
"277","2.261962","172.16.156.130","10.128.0.243","TCP","1514","","","50940  >  445 [ACK] Seq=1593 Ack=1 Win=64240 Len=1460 [TCP segment of a reassembled PDU]"
"278","2.261968","172.16.156.130","10.128.0.243","TCP","1206","","","50940  >  445 [PSH, ACK] Seq=3053 Ack=1 Win=64240 Len=1152 [TCP segment of a reassembled PDU]"
"279","2.261982","10.128.0.243","172.16.156.130","TCP","54","","","445  >  50932 [ACK] Seq=1 Ack=3053 Win=64240 Len=0"
"280","2.262043","172.16.156.130","10.128.0.243","TCP","1514","","","50941  >  445 [ACK] Seq=133 Ack=1 Win=64240 Len=1460 [TCP segment of a reassembled PDU]"
"281","2.262052","10.128.0.243","172.16.156.130","TCP","54","","","445  >  50932 [ACK] Seq=1 Ack=4205 Win=64240 Len=0"
"282","2.262053","172.16.156.130","10.128.0.243","TCP","1514","","","50941  >  445 [ACK] Seq=1593 Ack=1 Win=64240 Len=1460 [TCP segment of a reassembled PDU]"
"283","2.262060","172.16.156.130","10.128.0.243","TCP","1206","","","50941  >  445 [PSH, ACK] Seq=3053 Ack=1 Win=64240 Len=1152 [TCP segment of a reassembled PDU]"
"284","2.262120","172.16.156.130","10.128.0.243","TCP","1514","","","50943  >  445 [ACK] Seq=133 Ack=1 Win=64240 Len=1460 [TCP segment of a reassembled PDU]"
"285","2.262128","172.16.156.130","10.128.0.243","TCP","1514","","","50943  >  445 [ACK] Seq=1593 Ack=1 Win=64240 Len=1460 [TCP segment of a reassembled PDU]"
"286","2.262130","10.128.0.243","172.16.156.130","TCP","54","","","445  >  50933 [ACK] Seq=1 Ack=1593 Win=64240 Len=0"
"287","2.262135","172.16.156.130","10.128.0.243","TCP","1206","","","50943  >  445 [PSH, ACK] Seq=3053 Ack=1 Win=64240 Len=1152 [TCP segment of a reassembled PDU]"
"288","2.262195","172.16.156.130","10.128.0.243","TCP","1514","","","50944  >  445 [ACK] Seq=133 Ack=1 Win=64240 Len=1460 [TCP segment of a reassembled PDU]"
"289","2.262204","172.16.156.130","10.128.0.243","TCP","1514","","","50944  >  445 [ACK] Seq=1593 Ack=1 Win=64240 Len=1460 [TCP segment of a reassembled PDU]"
"290","2.262209","10.128.0.243","172.16.156.130","TCP","54","","","445  >  50933 [ACK] Seq=1 Ack=3053 Win=64240 Len=0"
"291","2.262211","172.16.156.130","10.128.0.243","TCP","1206","","","50944  >  445 [PSH, ACK] Seq=3053 Ack=1 Win=64240 Len=1152 [TCP segment of a reassembled PDU]"
"292","2.262269","172.16.156.130","10.128.0.243","TCP","1514","","","50945  >  445 [ACK] Seq=133 Ack=1 Win=64240 Len=1460 [TCP segment of a reassembled PDU]"
"293","2.262277","10.128.0.243","172.16.156.130","TCP","54","","","445  >  50933 [ACK] Seq=1 Ack=4205 Win=64240 Len=0"
"294","2.262341","172.16.156.130","10.128.0.243","TCP","1514","","","50945  >  445 [ACK] Seq=1593 Ack=1 Win=64240 Len=1460 [TCP segment of a reassembled PDU]"
